{
  "schema_version": 1,
  "implementation_commit": "62969f47e21f6679818a37500f3d8226d3ef2722",
  "requirements":[{"id":"REQ-PROC-001","status":"pass","proofs":[{"kind":"source","path":"docs/PROCEDURE_INDEX.md","lines":[1,18],"sha256":"dbb01cf218cf5324998df6357e5b793c7fc51801c08793793e64c8f80f4d5e2f"}]},{"id":"REQ-REPORT-001","status":"pass","proofs":[{"kind":"source","path":"docs/AGENT_REPORTING.md","lines":[1,28],"sha256":"396a9aa184473a33f316bdbf627a8592de968d81598253ec51ba629002b4f7d6"}]},{"id":"REQ-MERGE-001","status":"pass","proofs":[{"kind":"source","path":"prompts/AGENT_FINALIZE_MERGE.md","lines":[1,13],"sha256":"35c161108c796e89fafc7cd318dea3861c80530127e914aea79d5ecfade61e0d"}]},{"id":"REQ-HANDOFF-001","status":"pass","proofs":[{"kind":"source","path":"docs/PATCH_PACK_HANDOFF.md","lines":[1,8],"sha256":"9e4c2afcd89c5696e68a37d8f500afa4a6f0718f8f0c29fa300c6e040a37edb4"}]},{"id":"REQ-RELEASE-001","status":"pass","proofs":[{"kind":"source","path":"docs/RELEASE_PROCESS.md","lines":[1,5],"sha256":"15bccdca451c15834aac285652b5bb1e2fd27f940a557888e0ad308950904de2"}]},{"id":"REQ-TEST-001","status":"pass","proofs":[{"kind":"test","path":"tests/test_procedure_index_and_reporting.py","lines":[1,35],"sha256":"eca376dd38dc5fe39cc8f3245f1577f34c9220b3be60b1487cdc1ac78a6a385d"}]}],
  "gates":[{"id":"local-gates","status":"pass","exit":0,"tests":144,"summary":"Complete local gates passed."},{"id":"implementation-ci","status":"pass","run":30388121857,"job":90372472613,"url":"https://github.com/rceman/gpt-review-planner/actions/runs/30388121857/job/90372472613","summary":"Exact implementation SHA CI succeeded."}],
  "deviations":[]
}
